{
  "environment": "dev",
  "expectedBindingVersion": 7,
  "previous": null,
  "process": "buffer-features",
  "promotedBy": {
    "actor": "mikemcdougall",
    "sourceRun": "https://github.com/honua-io/honua-release/actions/runs/1"
  },
  "release": {
    "lockDigest": "sha256:3e8baa9ac547cc4123ca56188893d92e7996f75682663e34a87c397df02b6b4e",
    "lockPath": "release/gp-process-locks/buffer-features/3e8baa9ac547.json"
  },
  "schema": "honua.gp-environment-pin/v1"
}
